{
  "schema_version": "1.0",
  "bundle_id": "narwhal-bundle-v1.1.0",
  "target_version": "v1.1.0",
  "created_at": "2026-08-25T00:00:00Z",
  "promotion_stage": "staged",
  "compatibility_matrix_ref": "docs/common/compatibility-matrix.json#v1.1.0",
  "provenance": {
    "author": "dasomel/narwhal-release",
    "source_repo": "https://github.com/dasomel/narwhal",
    "signature": "sha256:fedcba9876543210fedcba9876543210fedcba9876543210fedcba9876543210"
  },
  "artifacts": [
    {
      "name": "cert-manager-controller",
      "version": "v1.17.0",
      "artifact_type": "container_image",
      "digest": "sha256:4444444444444444444444444444444444444444444444444444444444444444",
      "source_ref": "quay.io/jetstack/cert-manager-controller:v1.17.0",
      "license": "Apache-2.0",
      "size_bytes": 47000000
    },
    {
      "name": "cert-manager-chart",
      "version": "v1.17.0",
      "artifact_type": "helm_chart",
      "digest": "sha256:5555555555555555555555555555555555555555555555555555555555555555",
      "source_ref": "https://charts.jetstack.io/charts/cert-manager-v1.17.0.tgz",
      "license": "Apache-2.0",
      "size_bytes": 125000
    },
    {
      "name": "trivy-db",
      "version": "20260825",
      "artifact_type": "operator_package",
      "digest": "sha256:6666666666666666666666666666666666666666666666666666666666666666",
      "source_ref": "ghcr.io/aquasecurity/trivy-db:2",
      "license": "Apache-2.0",
      "size_bytes": 125000000
    },
    {
      "name": "kyverno-operator",
      "version": "v1.13.0",
      "artifact_type": "container_image",
      "digest": "sha256:7777777777777777777777777777777777777777777777777777777777777777",
      "source_ref": "ghcr.io/kyverno/kyverno:v1.13.0",
      "license": "Apache-2.0",
      "size_bytes": 52000000,
      "dependencies": [
        "cert-manager-controller"
      ]
    },
    {
      "name": "sbom-v1.1.0",
      "version": "v1.1.0",
      "artifact_type": "sbom_attestation",
      "digest": "sha256:8888888888888888888888888888888888888888888888888888888888888888",
      "source_ref": "ghcr.io/dasomel/narwhal-sbom:v1.1.0",
      "license": "Apache-2.0",
      "size_bytes": 850000
    }
  ]
}
